budget,genres,id,popularity,revenue,runtime,tagline,title,vote_average,vote_count,release_year,release_month,release_day,collection_id,collection_name
0.0,"[{'id': 80, 'name': 'Crime'}, {'id': 18, 'name': 'Drama'}]",56508,0.791727,0.0,54.0,,Fantômas: In the Shadow of the Guillotine,6.7,13.0,1913,5,9,188534,Fantômas Serial
0.0,"[{'id': 80, 'name': 'Crime'}, {'id': 18, 'name': 'Drama'}]",56511,0.787866,0.0,59.0,,Fantômas: Juve Against Fantômas,6.4,11.0,1913,9,12,188534,Fantômas Serial
0.0,"[{'id': 80, 'name': 'Crime'}, {'id': 18, 'name': 'Drama'}]",56516,0.414734,0.0,90.0,,Fantômas: The Dead Man Who Killed,6.4,8.0,1913,11,28,188534,Fantômas Serial
0.0,"[{'id': 80, 'name': 'Crime'}, {'id': 18, 'name': 'Drama'}]",56512,0.322249,0.0,59.0,,Fantômas: Fantômas Against Fantômas,6.2,8.0,1914,3,13,188534,Fantômas Serial
0.0,"[{'id': 80, 'name': 'Crime'}, {'id': 18, 'name': 'Drama'}]",56515,0.237483,0.0,70.0,,Fantômas: The False Magistrate,5.4,6.0,1914,5,8,188534,Fantômas Serial
0.0,"[{'id': 12, 'name': 'Adventure'}]",91893,0.301984,0.0,69.0,,The Spiders - The Golden Sea,5.7,5.0,1919,10,3,189295,The Spiders Serial
0.0,"[{'id': 12, 'name': 'Adventure'}]",92332,0.315662,0.0,130.0,,The Spiders - The Diamond Ship,5.8,5.0,1920,2,2,189295,The Spiders Serial
0.0,"[{'id': 12, 'name': 'Adventure'}, {'id': 18, 'name': 'Drama'}, {'id': 14, 'name': 'Fantasy'}]",31506,1.827403,0.0,140.0,,Die Nibelungen: Siegfried,7.7,19.0,1924,2,13,158038,Die Nibelungen Collection
0.0,"[{'id': 12, 'name': 'Adventure'}, {'id': 18, 'name': 'Drama'}, {'id': 14, 'name': 'Fantasy'}]",42512,0.828949,0.0,129.0,,Die Nibelungen: Kriemhild's Revenge,7.5,14.0,1924,4,25,158038,Die Nibelungen Collection
217000.0,"[{'id': 18, 'name': 'Drama'}, {'id': 27, 'name': 'Horror'}, {'id': 10749, 'name': 'Romance'}]",27503,1.48162,0.0,63.0,,The Unknown,7.6,24.0,1927,6,4,48802,I Love a Mystery movie series
0.0,"[{'id': 18, 'name': 'Drama'}, {'id': 14, 'name': 'Fantasy'}]",82088,0.305708,0.0,90.0,,Zvenigora,7.8,6.0,1928,4,13,441443,Ukraine Trilogy
0.0,"[{'id': 18, 'name': 'Drama'}, {'id': 10752, 'name': 'War'}]",85715,0.811576,0.0,70.0,,Arsenal,7.0,7.0,1929,2,25,441443,Ukraine Trilogy
0.0,"[{'id': 9648, 'name': 'Mystery'}]",61546,0.743953,0.0,88.0,ALL-TALKING!...ALL-THRILLS!,The Bishop Murder Case,3.6,4.0,1930,1,3,281097,Philo Vance Collection
0.0,"[{'id': 18, 'name': 'Drama'}]",46594,1.289409,0.0,75.0,,Earth,7.1,28.0,1930,4,8,441443,Ukraine Trilogy
355000.0,"[{'id': 27, 'name': 'Horror'}]",138,7.503126,1012189.0,72.0,The story of the strangest passion the world has ever known!,Dracula,7.2,254.0,1931,2,12,221539,Dracula (Universal Series)
0.0,"[{'id': 53, 'name': 'Thriller'}, {'id': 80, 'name': 'Crime'}, {'id': 35, 'name': 'Comedy'}, {'id': 9648, 'name': 'Mystery'}, {'id': 18, 'name': 'Drama'}]",38453,0.377614,0.0,71.0,,The Black Camel,5.2,10.0,1931,6,21,38451,Charlie Chan (Warner Oland) Collection
0.0,"[{'id': 35, 'name': 'Comedy'}, {'id': 18, 'name': 'Drama'}]",42818,0.858991,0.0,130.0,,Marius,6.6,9.0,1931,10,9,156152,La Trilogie Marseillaise
291000.0,"[{'id': 18, 'name': 'Drama'}, {'id': 27, 'name': 'Horror'}, {'id': 878, 'name': 'Science Fiction'}]",3035,8.091603,12000000.0,71.0,The man who made a monster.,Frankenstein,7.3,295.0,1931,11,21,218406,Frankenstein (Universal Series)
0.0,"[{'id': 18, 'name': 'Drama'}, {'id': 14, 'name': 'Fantasy'}]",36877,1.547374,0.0,55.0,,The Blood of a Poet,6.7,27.0,1932,1,20,84923,The Orphic Trilogy
0.0,"[{'id': 9648, 'name': 'Mystery'}]",267333,0.007941,0.0,73.0,"With eyes that see all, lips that tell nothing, Charlie Chan unmasks the most sinister crime of his career.",Charlie Chan's Chance,0.0,0.0,1932,1,24,38451,Charlie Chan (Warner Oland) Collection
0.0,"[{'id': 28, 'name': 'Action'}, {'id': 12, 'name': 'Adventure'}]",26845,4.179063,0.0,100.0,Mothered by an ape--He knew only the law of the jungle--to seize what he wanted!,Tarzan the Ape Man,6.5,42.0,1932,4,2,65249,Tarzan (Johnny Weissmuller series)
0.0,[],156389,0.14299,0.0,10.0,,Runt Page,5.3,2.0,1932,4,11,164072,Baby Burlesks
0.0,[],156388,0.008399,0.0,10.0,,The Pie-Covered Wagon,0.0,0.0,1932,10,30,164072,Baby Burlesks
0.0,"[{'id': 35, 'name': 'Comedy'}, {'id': 18, 'name': 'Drama'}]",43146,0.507325,0.0,140.0,,Fanny,6.6,9.0,1932,11,2,156152,La Trilogie Marseillaise
196000.0,"[{'id': 27, 'name': 'Horror'}]",15849,12.190044,0.0,73.0,It comes to life!,The Mummy,6.9,121.0,1932,12,22,221544,The Mummy (Universal Series)
672000.0,"[{'id': 28, 'name': 'Action'}, {'id': 12, 'name': 'Adventure'}, {'id': 18, 'name': 'Drama'}, {'id': 27, 'name': 'Horror'}]",244,8.73274,10000000.0,100.0,A Monster of Creation's Dawn Breaks Loose in Our World Today!,King Kong,7.7,346.0,1933,4,7,135495,King Kong (1933 series)
0.0,"[{'id': 9648, 'name': 'Mystery'}]",413669,0.00554,0.0,70.0,,Charlie Chan's Greatest Case,0.0,0.0,1933,9,14,38451,Charlie Chan (Warner Oland) Collection
328000.0,"[{'id': 27, 'name': 'Horror'}, {'id': 878, 'name': 'Science Fiction'}]",10787,5.192905,0.0,71.0,CARL LAEMMLE presents H.G. WELLS' FANTASTIC SENSATION,The Invisible Man,7.3,151.0,1933,11,13,259401,The Invisible Man (Universal Series)
250000.0,"[{'id': 12, 'name': 'Adventure'}, {'id': 27, 'name': 'Horror'}, {'id': 28, 'name': 'Action'}, {'id': 878, 'name': 'Science Fiction'}]",43149,1.771424,0.0,70.0,SEE! The cannibals! The earthquake! The sea serpent! The fighting monsters of ages past!,The Son of Kong,5.2,31.0,1933,12,22,135495,King Kong (1933 series)
95.0,"[{'id': 18, 'name': 'Drama'}, {'id': 12, 'name': 'Adventure'}, {'id': 28, 'name': 'Action'}]",18994,12.73076,0.0,100.0,Johnny Weismuller is back again!,Tarzan and His Mate,6.1,38.0,1934,4,20,65249,Tarzan (Johnny Weissmuller series)
226408.0,"[{'id': 35, 'name': 'Comedy'}, {'id': 80, 'name': 'Crime'}, {'id': 9648, 'name': 'Mystery'}]",3529,10.573867,1423000.0,93.0,A laugh tops every thrilling moment!,The Thin Man,7.4,97.0,1934,5,25,47814,The Thin Man Collection
0.0,"[{'id': 9648, 'name': 'Mystery'}]",267336,0.119178,0.0,70.0,,Charlie Chan's Courage,0.0,0.0,1934,7,6,38451,Charlie Chan (Warner Oland) Collection
0.0,"[{'id': 80, 'name': 'Crime'}, {'id': 18, 'name': 'Drama'}, {'id': 9648, 'name': 'Mystery'}, {'id': 53, 'name': 'Thriller'}, {'id': 35, 'name': 'Comedy'}]",33391,0.727814,0.0,79.0,"When all others failed, they turned to...",Charlie Chan in London,6.1,10.0,1934,9,12,38451,Charlie Chan (Warner Oland) Collection
0.0,"[{'id': 35, 'name': 'Comedy'}, {'id': 80, 'name': 'Crime'}, {'id': 18, 'name': 'Drama'}, {'id': 9648, 'name': 'Mystery'}, {'id': 53, 'name': 'Thriller'}]",33393,0.553082,0.0,72.0,,Charlie Chan in Paris,6.8,6.0,1935,1,21,38451,Charlie Chan (Warner Oland) Collection
0.0,"[{'id': 18, 'name': 'Drama'}, {'id': 28, 'name': 'Action'}, {'id': 9648, 'name': 'Mystery'}]",87881,0.065943,0.0,82.0,,The Casino Murder Case,5.0,2.0,1935,3,15,281097,Philo Vance Collection
393750.0,"[{'id': 27, 'name': 'Horror'}, {'id': 878, 'name': 'Science Fiction'}]",229,7.000417,0.0,75.0,The monster demands a mate.,Bride of Frankenstein,7.4,208.0,1935,4,21,218406,Frankenstein (Universal Series)
0.0,"[{'id': 14, 'name': 'Fantasy'}, {'id': 27, 'name': 'Horror'}, {'id': 18, 'name': 'Drama'}]",27970,8.579045,0.0,75.0,Beware the Stalking Being - Half-Human - Half-Beast!,Werewolf of London,6.4,32.0,1935,5,13,259027,The Wolf Man (Universal Series)
0.0,"[{'id': 80, 'name': 'Crime'}, {'id': 53, 'name': 'Thriller'}, {'id': 9648, 'name': 'Mystery'}, {'id': 18, 'name': 'Drama'}, {'id': 35, 'name': 'Comedy'}]",33390,1.06717,0.0,73.0,,Charlie Chan in Egypt,6.4,10.0,1935,6,4,38451,Charlie Chan (Warner Oland) Collection
0.0,"[{'id': 80, 'name': 'Crime'}, {'id': 35, 'name': 'Comedy'}, {'id': 9648, 'name': 'Mystery'}, {'id': 53, 'name': 'Thriller'}]",33395,1.540778,0.0,71.0,,Charlie Chan in Shanghai,7.0,8.0,1935,10,14,38451,Charlie Chan (Warner Oland) Collection
0.0,"[{'id': 35, 'name': 'Comedy'}, {'id': 18, 'name': 'Drama'}]",43873,0.349258,0.0,141.0,,César,9.0,3.0,1936,1,1,156152,La Trilogie Marseillaise
0.0,"[{'id': 80, 'name': 'Crime'}, {'id': 9648, 'name': 'Mystery'}, {'id': 18, 'name': 'Drama'}, {'id': 53, 'name': 'Thriller'}]",33708,0.630625,0.0,72.0,San Francisco is the scene of Chan's newest and most baffling mystery!,Charlie Chan's Secret,7.4,8.0,1936,1,17,38451,Charlie Chan (Warner Oland) Collection
0.0,"[{'id': 80, 'name': 'Crime'}, {'id': 9648, 'name': 'Mystery'}, {'id': 35, 'name': 'Comedy'}, {'id': 53, 'name': 'Thriller'}]",33386,0.296281,0.0,72.0,,Charlie Chan at the Circus,6.7,6.0,1936,3,27,38451,Charlie Chan (Warner Oland) Collection
0.0,"[{'id': 18, 'name': 'Drama'}, {'id': 14, 'name': 'Fantasy'}, {'id': 27, 'name': 'Horror'}]",22440,2.076008,0.0,71.0,She gives you that WEIRD FEELING,Dracula's Daughter,6.3,24.0,1936,5,11,221539,Dracula (Universal Series)
0.0,"[{'id': 35, 'name': 'Comedy'}]",82237,0.009626,0.0,57.0,,"Thank You, Jeeves!",0.0,0.0,1936,6,30,122778,Wodehouse P.G. Collection
0.0,"[{'id': 36, 'name': 'History'}, {'id': 18, 'name': 'Drama'}]",195522,1.381365,0.0,65.0,,Redes,5.0,1.0,1936,7,15,303969,"Martin Scorsese’s World Cinema Project, Vol. 1"
0.0,"[{'id': 9648, 'name': 'Mystery'}, {'id': 35, 'name': 'Comedy'}, {'id': 53, 'name': 'Thriller'}, {'id': 80, 'name': 'Crime'}]",33387,0.533025,0.0,70.0,,Charlie Chan at the Race Track,6.9,9.0,1936,8,14,38451,Charlie Chan (Warner Oland) Collection
0.0,"[{'id': 28, 'name': 'Action'}, {'id': 12, 'name': 'Adventure'}]",38661,1.610075,0.0,89.0,It's New! It's amazing! 2 years to produce!,Tarzan Escapes,6.3,14.0,1936,11,6,65249,Tarzan (Johnny Weissmuller series)
0.0,"[{'id': 80, 'name': 'Crime'}, {'id': 18, 'name': 'Drama'}, {'id': 9648, 'name': 'Mystery'}, {'id': 53, 'name': 'Thriller'}]",28044,1.430149,0.0,68.0,A fiendish killer lurks at the opera! Weird! Thrilling! The Master Minds of Crime Match Wits Against Each Other!,Charlie Chan at the Opera,6.6,14.0,1936,12,5,38451,Charlie Chan (Warner Oland) Collection
0.0,"[{'id': 35, 'name': 'Comedy'}, {'id': 80, 'name': 'Crime'}, {'id': 9648, 'name': 'Mystery'}]",14588,7.201727,0.0,112.0,Continuing the fun in their NEW hit!,After the Thin Man,7.1,30.0,1936,12,25,47814,The Thin Man Collection
0.0,"[{'id': 28, 'name': 'Action'}, {'id': 18, 'name': 'Drama'}, {'id': 9648, 'name': 'Mystery'}, {'id': 53, 'name': 'Thriller'}]",25148,1.131624,0.0,71.0,Murderous Spies invade Olympic Games!,Charlie Chan at the Olympics,7.0,7.0,1937,5,21,38451,Charlie Chan (Warner Oland) Collection
500000.0,"[{'id': 35, 'name': 'Comedy'}, {'id': 14, 'name': 'Fantasy'}, {'id': 10749, 'name': 'Romance'}]",23101,3.1574,0.0,97.0,90 ROARING MINUTES OF LAUGHS!,Topper,6.2,21.0,1937,7,16,438087,Topper Collection
0.0,"[{'id': 80, 'name': 'Crime'}, {'id': 9648, 'name': 'Mystery'}, {'id': 53, 'name': 'Thriller'}, {'id': 18, 'name': 'Drama'}]",59566,3.997872,0.0,67.0,Meet.... MR. MOTO the foxiest detective of them all!,"Think Fast, Mr. Moto",6.2,8.0,1937,7,27,89959,Mr. Moto Collection
0.0,"[{'id': 80, 'name': 'Crime'}, {'id': 9648, 'name': 'Mystery'}, {'id': 53, 'name': 'Thriller'}, {'id': 18, 'name': 'Drama'}]",38454,0.839146,0.0,68.0,,Charlie Chan on Broadway,7.3,8.0,1937,9,22,38451,Charlie Chan (Warner Oland) Collection
0.0,"[{'id': 9648, 'name': 'Mystery'}]",105073,0.606175,0.0,62.0,Scourge of the underworld!,The Shadow Strikes,3.7,3.0,1937,10,29,105075,The Shadow Collection
0.0,"[{'id': 35, 'name': 'Comedy'}, {'id': 80, 'name': 'Crime'}, {'id': 9648, 'name': 'Mystery'}, {'id': 53, 'name': 'Thriller'}]",38455,0.714825,0.0,71.0,"Triple murder for high stakes! A new high in mystery excitement! And laughs, too!",Charlie Chan at Monte Carlo,6.5,7.0,1937,12,17,38451,Charlie Chan (Warner Oland) Collection
0.0,"[{'id': 9648, 'name': 'Mystery'}, {'id': 53, 'name': 'Thriller'}, {'id': 80, 'name': 'Crime'}, {'id': 18, 'name': 'Drama'}]",59581,0.733865,0.0,67.0,,"Thank You, Mr. Moto",5.1,5.0,1937,12,24,89959,Mr. Moto Collection
0.0,"[{'id': 80, 'name': 'Crime'}, {'id': 18, 'name': 'Drama'}]",160162,0.244976,0.0,63.0,BEWARE! Snappy Snoopy Blonde at Work!,Blondes at Work,7.3,2.0,1938,2,5,393326,Torchy Blane
0.0,"[{'id': 18, 'name': 'Drama'}, {'id': 9648, 'name': 'Mystery'}, {'id': 53, 'name': 'Thriller'}]",59584,1.060894,0.0,72.0,,Mr. Moto's Gamble,6.3,5.0,1938,4,7,89959,Mr. Moto Collection
0.0,"[{'id': 99, 'name': 'Documentary'}]",685,0.818906,0.0,100.0,,Olympia Part Two: Festival of Beauty,6.2,14.0,1938,4,20,404148,Olympia
0.0,"[{'id': 99, 'name': 'Documentary'}]",677,1.530927,0.0,126.0,,Olympia Part One: Festival of the Nations,6.6,17.0,1938,4,20,404148,Olympia
0.0,"[{'id': 80, 'name': 'Crime'}, {'id': 35, 'name': 'Comedy'}]",171346,0.642796,0.0,59.0,,Torchy Blane in Panama,6.0,2.0,1938,5,7,393326,Torchy Blane
0.0,"[{'id': 18, 'name': 'Drama'}, {'id': 53, 'name': 'Thriller'}, {'id': 80, 'name': 'Crime'}, {'id': 9648, 'name': 'Mystery'}]",38774,0.539182,0.0,63.0,,Mr. Moto Takes a Chance,5.2,3.0,1938,6,24,89959,Mr. Moto Collection
0.0,"[{'id': 18, 'name': 'Drama'}]",42390,1.437573,0.0,96.0,"No boy is bad, if given a chance!",Boys Town,6.6,25.0,1938,9,9,413937,Father Flanagan Collection
0.0,"[{'id': 18, 'name': 'Drama'}]",129417,0.981955,0.0,98.0,,The Childhood of Maxim Gorky,7.3,4.0,1938,9,27,175722,The Gorky Collection
0.0,"[{'id': 9648, 'name': 'Mystery'}, {'id': 53, 'name': 'Thriller'}, {'id': 80, 'name': 'Crime'}, {'id': 18, 'name': 'Drama'}]",29484,1.282223,0.0,62.0,Peter Lorre gives you your greatest thrill,Mysterious Mr. Moto,5.1,4.0,1938,10,14,89959,Mr. Moto Collection
0.0,"[{'id': 35, 'name': 'Comedy'}, {'id': 9648, 'name': 'Mystery'}]",47883,0.150389,0.0,66.0,,Nancy Drew: Detective,7.5,3.0,1938,11,19,354066,The Nancy Drew Collection (Bonita Granville)
0.0,"[{'id': 35, 'name': 'Comedy'}, {'id': 14, 'name': 'Fantasy'}, {'id': 10749, 'name': 'Romance'}]",54430,0.947509,0.0,80.0,A merry romance packed with fun!,Topper Takes a Trip,6.3,3.0,1938,12,29,438087,Topper Collection
0.0,"[{'id': 9648, 'name': 'Mystery'}, {'id': 80, 'name': 'Crime'}, {'id': 18, 'name': 'Drama'}, {'id': 35, 'name': 'Comedy'}, {'id': 53, 'name': 'Thriller'}]",33392,0.606726,0.0,67.0,,Charlie Chan in Honolulu,6.9,5.0,1938,12,30,413661,Charlie Chan (Sidney Toler) Collection
0.0,"[{'id': 35, 'name': 'Comedy'}, {'id': 18, 'name': 'Drama'}]",14589,1.881187,0.0,103.0,Their Merriest Hit! Mr. and Mrs. Thin Man Have a B-A-B-Y!,Another Thin Man,7.0,20.0,1939,1,1,47814,The Thin Man Collection
0.0,"[{'id': 27, 'name': 'Horror'}, {'id': 878, 'name': 'Science Fiction'}]",3077,3.563588,0.0,99.0,The black shadows of the past bred this half-man . . . half-demon ! . . . creating a new and terrible juggernaut of destruction !,Son of Frankenstein,7.0,42.0,1939,1,13,218406,Frankenstein (Universal Series)
0.0,"[{'id': 28, 'name': 'Action'}, {'id': 53, 'name': 'Thriller'}, {'id': 9648, 'name': 'Mystery'}]",18705,0.838547,0.0,71.0,,Mr. Moto's Last Warning,5.5,6.0,1939,1,20,89959,Mr. Moto Collection
0.0,"[{'id': 9648, 'name': 'Mystery'}, {'id': 12, 'name': 'Adventure'}]",149793,0.3154,0.0,71.0,WANTED As A Spy Suspect!,The Lone Wolf Spy Hunt,7.0,1.0,1939,1,27,395433,Lone Wolf film series
0.0,"[{'id': 35, 'name': 'Comedy'}, {'id': 80, 'name': 'Crime'}, {'id': 9648, 'name': 'Mystery'}]",23280,0.811435,0.0,68.0,STOP THE PRESSES! Nancy's on the trail of a terrific SCOOP!,Nancy Drew... Reporter,6.7,5.0,1939,2,18,354066,The Nancy Drew Collection (Bonita Granville)
0.0,"[{'id': 9648, 'name': 'Mystery'}, {'id': 53, 'name': 'Thriller'}]",27118,2.722222,0.0,80.0,,The Hound of the Baskervilles,7.3,45.0,1939,3,31,478628,Sherlock Holmes (1939 series)
0.0,"[{'id': 80, 'name': 'Crime'}, {'id': 18, 'name': 'Drama'}, {'id': 9648, 'name': 'Mystery'}, {'id': 53, 'name': 'Thriller'}]",59589,0.224115,0.0,64.0,HUNTED BY THE POLICE!...STALKED BY A KILLER!,Mr. Moto in Danger Island,6.5,6.0,1939,4,7,89959,Mr. Moto Collection
0.0,"[{'id': 28, 'name': 'Action'}, {'id': 12, 'name': 'Adventure'}]",40044,2.40912,0.0,82.0,Super Story of a Super Man ! The Titan of all Tarzans . . . Giant of all jungle thrills . . . worth the years it took to make !,Tarzan Finds a Son!,5.8,22.0,1939,6,16,65249,Tarzan (Johnny Weissmuller series)
0.0,"[{'id': 9648, 'name': 'Mystery'}, {'id': 53, 'name': 'Thriller'}]",33394,1.02741,0.0,70.0,,Charlie Chan in Reno,6.3,4.0,1939,6,16,413661,Charlie Chan (Sidney Toler) Collection
0.0,"[{'id': 35, 'name': 'Comedy'}, {'id': 9648, 'name': 'Mystery'}]",47884,0.270507,0.0,68.0,,Nancy Drew... Trouble Shooter,7.5,3.0,1939,6,17,354066,The Nancy Drew Collection (Bonita Granville)
0.0,"[{'id': 9648, 'name': 'Mystery'}]",74545,1.068317,0.0,72.0,He's at it again! Fiction's fighting man of mystery! Chasing down the most dramatic crime in London legend! Shock-charged drama--with a peppery bit of love on the side! You'll laugh--shiver--THRILL!,The Saint In London,5.4,5.0,1939,6,30,86224,The Saint Collection
0.0,"[{'id': 9648, 'name': 'Mystery'}, {'id': 53, 'name': 'Thriller'}]",59701,0.165704,0.0,71.0,,Mr. Wong in Chinatown,4.5,3.0,1939,8,1,220448,Mr. Wong Collection
0.0,"[{'id': 9648, 'name': 'Mystery'}, {'id': 53, 'name': 'Thriller'}]",33388,0.597515,0.0,72.0,The strange case of murder by magic!,Charlie Chan at Treasure Island,6.6,9.0,1939,8,31,413661,Charlie Chan (Sidney Toler) Collection
0.0,"[{'id': 80, 'name': 'Crime'}, {'id': 9648, 'name': 'Mystery'}, {'id': 53, 'name': 'Thriller'}]",17481,2.561651,0.0,85.0,The Struggle of Super-Minds in the Crime of the Century!,The Adventures of Sherlock Holmes,7.2,26.0,1939,9,1,478628,Sherlock Holmes (1939 series)
0.0,"[{'id': 35, 'name': 'Comedy'}, {'id': 80, 'name': 'Crime'}, {'id': 9648, 'name': 'Mystery'}]",47882,0.153571,0.0,60.0,,Nancy Drew and the Hidden Staircase,7.4,4.0,1939,9,9,354066,The Nancy Drew Collection (Bonita Granville)
0.0,[],148536,0.277691,0.0,100.0,,My Apprenticeship,5.0,1.0,1939,9,12,175722,The Gorky Collection
0.0,"[{'id': 80, 'name': 'Crime'}, {'id': 18, 'name': 'Drama'}, {'id': 53, 'name': 'Thriller'}, {'id': 9648, 'name': 'Mystery'}]",33389,1.068644,0.0,75.0,PARIS! BLACKOUT!...but there's no blackout for crime...and the great detective is commandeered!,City in Darkness,6.8,6.0,1939,11,15,413661,Charlie Chan (Sidney Toler) Collection
0.0,"[{'id': 80, 'name': 'Crime'}, {'id': 9648, 'name': 'Mystery'}, {'id': 18, 'name': 'Drama'}]",47404,0.081235,0.0,59.0,THE WIZARD OF CLUES!!! Nick Carter lives again in the fierce brutal...dangerous era of TODAY!,"Nick Carter, Master Detective",6.0,1.0,1939,12,15,47400,Nick Carter Collection
0.0,"[{'id': 18, 'name': 'Drama'}, {'id': 27, 'name': 'Horror'}, {'id': 9648, 'name': 'Mystery'}, {'id': 878, 'name': 'Science Fiction'}, {'id': 53, 'name': 'Thriller'}]",28421,1.360563,0.0,81.0,,The Invisible Man Returns,6.3,17.0,1940,1,12,259401,The Invisible Man (Universal Series)
0.0,"[{'id': 9648, 'name': 'Mystery'}, {'id': 53, 'name': 'Thriller'}]",59706,0.614139,0.0,68.0,,The Fatal Hour,6.5,4.0,1940,1,15,220448,Mr. Wong Collection
0.0,"[{'id': 35, 'name': 'Comedy'}, {'id': 53, 'name': 'Thriller'}, {'id': 10749, 'name': 'Romance'}, {'id': 18, 'name': 'Drama'}, {'id': 80, 'name': 'Crime'}]",85232,0.116017,0.0,67.0,,The Lone Wolf Strikes,6.5,2.0,1940,1,26,395433,Lone Wolf film series
0.0,"[{'id': 35, 'name': 'Comedy'}]",3937,0.44415,0.0,72.0,,Blondie on a Budget,6.5,4.0,1940,2,29,177062,Blondie Collection
0.0,"[{'id': 80, 'name': 'Crime'}, {'id': 18, 'name': 'Drama'}, {'id': 53, 'name': 'Thriller'}, {'id': 9648, 'name': 'Mystery'}, {'id': 35, 'name': 'Comedy'}]",38458,0.380712,0.0,66.0,One more minute... and the fleet is doomed!,Charlie Chan in Panama,6.8,7.0,1940,3,1,413661,Charlie Chan (Sidney Toler) Collection
0.0,"[{'id': 35, 'name': 'Comedy'}]",13861,1.226779,0.0,85.0,Ready For Fun . . Fight . . or a South Seas Romance . . . ! They find them all on the . . .,Road to Singapore,6.7,12.0,1940,3,22,135441,Road to Collection
0.0,"[{'id': 35, 'name': 'Comedy'}, {'id': 80, 'name': 'Crime'}, {'id': 9648, 'name': 'Mystery'}, {'id': 53, 'name': 'Thriller'}]",38456,0.860084,0.0,77.0,DEATH AFLOAT...striking swiftly. suddenly...leaving on each strangled victim a calling card of crimson coin...thirty pieces of silver!,Charlie Chan's Murder Cruise,7.3,6.0,1940,5,2,413661,Charlie Chan (Sidney Toler) Collection
0.0,"[{'id': 9648, 'name': 'Mystery'}, {'id': 35, 'name': 'Comedy'}, {'id': 18, 'name': 'Drama'}]",85231,0.071784,0.0,71.0,,The Lone Wolf Meets a Lady,6.8,2.0,1940,5,30,395433,Lone Wolf film series
0.0,"[{'id': 35, 'name': 'Comedy'}]",3936,0.486412,0.0,72.0,No one can hold a candle to them...when it comes to uproarious...wholesome fun!,Blondie Has Servant Trouble,7.7,3.0,1940,7,25,177062,Blondie Collection
0.0,"[{'id': 35, 'name': 'Comedy'}, {'id': 80, 'name': 'Crime'}, {'id': 9648, 'name': 'Mystery'}, {'id': 53, 'name': 'Thriller'}]",22965,0.456508,0.0,68.0,The master of crime cleans up the dirty game of murder!,Doomed to Die,6.4,5.0,1940,8,12,220448,Mr. Wong Collection
0.0,"[{'id': 80, 'name': 'Crime'}, {'id': 9648, 'name': 'Mystery'}, {'id': 18, 'name': 'Drama'}, {'id': 53, 'name': 'Thriller'}, {'id': 35, 'name': 'Comedy'}]",38457,0.514756,0.0,63.0,FOUR TIMES IN 18 EERIE MINUTES CHARLIE CHAN FACES DEATH! -- Death from a poison dart! -- Death from a streaking bullet! -- Death from a gleaming dagger!,Charlie Chan at the Wax Museum,8.4,5.0,1940,9,6,413661,Charlie Chan (Sidney Toler) Collection
0.0,"[{'id': 27, 'name': 'Horror'}]",31498,1.622519,0.0,67.0,The tomb of a thousand terrors!,The Mummy's Hand,6.5,14.0,1940,9,20,221544,The Mummy (Universal Series)
0.0,"[{'id': 9648, 'name': 'Mystery'}]",47401,0.331435,0.0,72.0,,Sky Murder,6.0,1.0,1940,9,27,47400,Nick Carter Collection
0.0,"[{'id': 35, 'name': 'Comedy'}]",3938,0.56455,0.0,72.0,,Blondie Plays Cupid,7.0,3.0,1940,10,31,177062,Blondie Collection
2280000.0,"[{'id': 16, 'name': 'Animation'}, {'id': 10751, 'name': 'Family'}, {'id': 10402, 'name': 'Music'}]",756,8.03796,83320000.0,124.0,The most sensational sound you'll ever see!,Fantasia,7.2,831.0,1940,11,13,55427,Fantasia Collection
0.0,"[{'id': 35, 'name': 'Comedy'}]",74384,0.400952,0.0,0.0,,San Giovanni decollato,5.7,3.0,1940,12,12,421566,Totò Collection
0.0,"[{'id': 80, 'name': 'Crime'}, {'id': 18, 'name': 'Drama'}, {'id': 9648, 'name': 'Mystery'}, {'id': 35, 'name': 'Comedy'}, {'id': 53, 'name': 'Thriller'}]",38459,0.816624,0.0,65.0,,Murder Over New York,6.3,6.0,1940,12,13,413661,Charlie Chan (Sidney Toler) Collection
0.0,"[{'id': 28, 'name': 'Action'}, {'id': 12, 'name': 'Adventure'}, {'id': 35, 'name': 'Comedy'}, {'id': 18, 'name': 'Drama'}]",23338,0.11681,0.0,68.0,,Pride of the Bowery,6.5,2.0,1940,12,15,415799,East Side Kids
0.0,"[{'id': 10749, 'name': 'Romance'}, {'id': 878, 'name': 'Science Fiction'}, {'id': 35, 'name': 'Comedy'}]",28423,1.294231,0.0,72.0,IT'S A Ghost-to-Ghost HOOK-UP!,The Invisible Woman,6.0,5.0,1940,12,27,259401,The Invisible Man (Universal Series)
0.0,"[{'id': 35, 'name': 'Comedy'}]",3941,0.411367,0.0,72.0,Where there's a Bumstead...there's always trouble and fun!,Blondie Goes Latin,8.0,3.0,1941,2,27,177062,Blondie Collection
0.0,"[{'id': 35, 'name': 'Comedy'}, {'id': 14, 'name': 'Fantasy'}, {'id': 9648, 'name': 'Mystery'}, {'id': 10749, 'name': 'Romance'}]",44875,1.000254,0.0,88.0,Topper's having girl trouble again!,Topper Returns,5.8,9.0,1941,3,21,438087,Topper Collection
0.0,"[{'id': 9648, 'name': 'Mystery'}, {'id': 53, 'name': 'Thriller'}, {'id': 80, 'name': 'Crime'}, {'id': 18, 'name': 'Drama'}, {'id': 35, 'name': 'Comedy'}]",38460,0.359691,0.0,61.0,Aboard a treasure ship Chan battles his most elusive adversary... the ghost of a pirate 100 years dead!,Dead Men Tell,6.8,6.0,1941,3,28,413661,Charlie Chan (Sidney Toler) Collection
0.0,"[{'id': 35, 'name': 'Comedy'}]",31812,1.208267,0.0,91.0,"IT'S THAT GLEESOME THREESOME AGAIN! Giving you your worth in mirth! Toping all the fun in ""Road to Singapore!""",Road to Zanzibar,5.8,9.0,1941,4,11,135441,Road to Collection
0.0,"[{'id': 27, 'name': 'Horror'}]",23104,1.387826,0.0,67.0,HUMAN SACRIFICES! SAVAGE TORTURE! VOODOO RITES!,King of the Zombies,5.3,7.0,1941,5,14,124930,King of the Zombies Collection
0.0,"[{'id': 35, 'name': 'Comedy'}, {'id': 9648, 'name': 'Mystery'}]",90460,1.00896,0.0,78.0,SURPRISE COMEDY HIT OF THE YEAR ! Don't Miss It !,Whistling in the Dark,6.2,3.0,1941,8,8,435108,Whistling Collection
0.0,"[{'id': 80, 'name': 'Crime'}, {'id': 9648, 'name': 'Mystery'}, {'id': 53, 'name': 'Thriller'}, {'id': 35, 'name': 'Comedy'}, {'id': 18, 'name': 'Drama'}]",38461,0.477933,0.0,60.0,,Charlie Chan in Rio,6.0,5.0,1941,9,5,413661,Charlie Chan (Sidney Toler) Collection
0.0,"[{'id': 35, 'name': 'Comedy'}, {'id': 9648, 'name': 'Mystery'}, {'id': 10749, 'name': 'Romance'}, {'id': 53, 'name': 'Thriller'}]",14590,2.671234,0.0,97.0,FUNNIER THAN EVER in their first new laugh-thriller in 2 years!,Shadow of the Thin Man,6.2,17.0,1941,11,21,47814,The Thin Man Collection
0.0,"[{'id': 28, 'name': 'Action'}, {'id': 12, 'name': 'Adventure'}, {'id': 10749, 'name': 'Romance'}]",40214,1.290506,0.0,81.0,The Greatest Tarzan Is Back!,Tarzan's Secret Treasure,5.5,13.0,1941,12,1,65249,Tarzan (Johnny Weissmuller series)
0.0,"[{'id': 27, 'name': 'Horror'}, {'id': 18, 'name': 'Drama'}]",13666,5.386984,0.0,70.0,"""His hideous howl a dirge of death!""",The Wolf Man,7.2,124.0,1941,12,12,259027,The Wolf Man (Universal Series)
0.0,"[{'id': 80, 'name': 'Crime'}, {'id': 9648, 'name': 'Mystery'}]",43551,0.280027,0.0,63.0,ALL NEW THRILLS!,A Date with the Falcon,7.0,4.0,1942,1,16,47630,The Falcon Series
0.0,"[{'id': 80, 'name': 'Crime'}, {'id': 27, 'name': 'Horror'}, {'id': 9648, 'name': 'Mystery'}, {'id': 53, 'name': 'Thriller'}]",29328,0.736539,0.0,62.0,Triple murder on a luxury line...Chan's best friend a victim!,Castle in the Desert,7.1,7.0,1942,2,2,413661,Charlie Chan (Sidney Toler) Collection
0.0,"[{'id': 14, 'name': 'Fantasy'}, {'id': 27, 'name': 'Horror'}, {'id': 878, 'name': 'Science Fiction'}]",3074,4.021579,0.0,67.0,All new THRILLS!,The Ghost of Frankenstein,6.4,26.0,1942,3,13,218406,Frankenstein (Universal Series)
